{
  "schema_version": 1,
  "content_version": "2026_07_005",
  "generated_at": "2026-07-17T22:00:00-06:00",
  "min_app_version": 31,
  "files": {
    "questions": {
      "url": "content/preguntas/banco_global.json",
      "version": "questions_002",
      "required": true
    },
    "challenges": {
      "url": "content/retos/retos_actuales.json",
      "version": "challenges_001",
      "required": false
    },
    "resources": {
      "url": "content/cards/cards_actuales.json",
      "version": "cards_001",
      "required": false
    },
    "ranks": {
      "url": "content/config/rangos.json",
      "version": "ranks_001",
      "required": false
    }
  }
}
